{
  "name": "Black Ops",
  "tag": "BOPS",
  "region": "SEA",
  "founded": "2024-01-15",
  "description": "A veteran squad known for aggressive pushes and clutch plays.",
  "players": ["rikkun159", "shadowz", "reaper01"],
  "stats": {
    "wins": 12,
    "losses": 3,
    "draws": 1,
    "matchesPlayed": 16
  }
}